pipeline/prospectus_pipeline/data/market/aftermarket/hk02667.json

[{"date": "2026-07-07", "open": 4.76, "close": 3.35, "high": 4.79, "low": 3.01, "volume": 43259960.0, "turnover": 163015600.0, "turnover_estimated": false}, {"date": "2026-07-08", "open": 3.23, "close": 3.12, "high": 3.28, "low": 3.1, "volume": 3308540.0, "turnover": 10460800.0, "turnover_estimated": false}, {"date": "2026-07-09", "open": 3.12, "close": 2.93, "high": 3.16, "low": 2.85, "volume": 4115000.0, "turnover": 12087100.0, "turnover_estimated": false}, {"date": "2026-07-10", "open": 2.9, "close": 2.75, "high": 2.93, "low": 2.73, "volume": 4683500.0, "turnover": 13069300.0, "turnover_estimated": false}, {"date": "2026-07-13", "open": 2.75, "close": 2.67, "high": 2.88, "low": 2.63, "volume": 3514000.0, "turnover": 9614300.0, "turnover_estimated": false}, {"date": "2026-07-14", "open": 2.62, "close": 3.04, "high": 3.05, "low": 2.62, "volume": 3187000.0, "turnover": 9006400.0, "turnover_estimated": false}, {"date": "2026-07-15", "open": 3.0, "close": 3.05, "high": 3.08, "low": 2.84, "volume": 1854500.0, "turnover": 5489299.999999999, "turnover_estimated": false}, {"date": "2026-07-16", "open": 3.05, "close": 2.88, "high": 3.05, "low": 2.86, "volume": 1710500.0, "turnover": 4990200.0, "turnover_estimated": false}, {"date": "2026-07-17", "open": 2.89, "close": 2.8, "high": 2.9, "low": 2.67, "volume": 1565000.0, "turnover": 4306800.0, "turnover_estimated": false}, {"date": "2026-07-20", "open": 2.8, "close": 2.93, "high": 3.08, "low": 2.75, "volume": 1149500.0, "turnover": 3355700.0, "turnover_estimated": false}, {"date": "2026-07-21", "open": 3.0, "close": 2.9, "high": 3.04, "low": 2.88, "volume": 833784.0, "turnover": 2436700.0, "turnover_estimated": false}, {"date": "2026-07-22", "open": 2.9, "close": 2.93, "high": 2.99, "low": 2.89, "volume": 352500.0, "turnover": 1031400.0, "turnover_estimated": false}, {"date": "2026-07-23", "open": 2.91, "close": 2.88, "high": 2.91, "low": 2.87, "volume": 384000.0, "turnover": 1110000.0, "turnover_estimated": false}, {"date": "2026-07-24", "open": 2.94, "close": 2.82, "high": 2.94, "low": 2.81, "volume": 448500.0, "turnover": 1271000.0, "turnover_estimated": false}, {"date": "2026-07-27", "open": 2.8, "close": 2.81, "high": 2.83, "low": 2.77, "volume": 295000.0, "turnover": 825500.0, "turnover_estimated": false}, {"date": "2026-07-28", "open": 2.81, "close": 2.79, "high": 2.83, "low": 2.7, "volume": 1092000.0, "turnover": 2988800.0, "turnover_estimated": false}, {"date": "2026-07-29", "open": 2.79, "close": 2.79, "high": 2.79, "low": 2.69, "volume": 1194500.0, "turnover": 3259500.0, "turnover_estimated": false}, {"date": "2026-07-30", "open": 2.84, "close": 2.69, "high": 2.84, "low": 2.68, "volume": 731000.0, "turnover": 1983600.0000000002, "turnover_estimated": false}, {"date": "2026-07-31", "open": 2.69, "close": 2.77, "high": 2.8, "low": 2.69, "volume": 1147500.0, "turnover": 3170700.0, "turnover_estimated": false}, {"date": "2026-08-03", "open": 2.725, "close": 3.0, "high": 3.0, "low": 2.725, "volume": 1256000.0, "turnover": 3635600.0, "turnover_estimated": false}, {"date": "2026-08-04", "open": 3.0, "close": 2.79, "high": 3.0, "low": 2.785, "volume": 963000.0, "turnover": 2708800.0, "turnover_estimated": false}, {"date": "2026-08-05", "open": 2.875, "close": 2.8, "high": 2.875, "low": 2.74, "volume": 267500.0, "turnover": 747700.0, "turnover_estimated": false}, {"date": "2026-08-06", "open": 2.895, "close": 2.765, "high": 2.895, "low": 2.74, "volume": 305000.0, "turnover": 841400.0, "turnover_estimated": false}, {"date": "2026-08-07", "open": 2.765, "close": 2.78, "high": 2.8, "low": 2.725, "volume": 386000.0, "turnover": 1065800.0, "turnover_estimated": false}, {"date": "2026-08-10", "open": 2.8, "close": 2.76, "high": 2.82, "low": 2.75, "volume": 209000.0, "turnover": 580100.0, "turnover_estimated": false}, {"date": "2026-08-11", "open": 2.76, "close": 2.815, "high": 2.83, "low": 2.735, "volume": 232500.0, "turnover": 640900.0, "turnover_estimated": false}, {"date": "2026-08-12", "open": 2.815, "close": 2.8, "high": 2.815, "low": 2.745, "volume": 76500.0, "turnover": 212300.0, "turnover_estimated": false}, {"date": "2026-08-13", "open": 2.79, "close": 2.785, "high": 2.81, "low": 2.76, "volume": 221500.0, "turnover": 617600.0, "turnover_estimated": false}, {"date": "2026-08-14", "open": 2.785, "close": 2.73, "high": 2.785, "low": 2.72, "volume": 247000.0, "turnover": 678800.0, "turnover_estimated": false}, {"date": "2026-08-17", "open": 2.73, "close": 2.71, "high": 2.73, "low": 2.7, "volume": 248500.0, "turnover": 673800.0, "turnover_estimated": false}, {"date": "2026-08-18", "open": 2.695, "close": 2.665, "high": 2.7, "low": 2.645, "volume": 381050.0, "turnover": 1013500.0, "turnover_estimated": false}, {"date": "2026-08-19", "open": 2.665, "close": 2.61, "high": 2.665, "low": 2.6, "volume": 277000.0, "turnover": 723900.0, "turnover_estimated": false}, {"date": "2026-08-20", "open": 2.595, "close": 2.655, "high": 2.73, "low": 2.59, "volume": 246550.0, "turnover": 651300.0, "turnover_estimated": false}, {"date": "2026-08-21", "open": 2.655, "close": 2.64, "high": 2.655, "low": 2.6, "volume": 97000.0, "turnover": 255799.99999999997, "turnover_estimated": false}, {"date": "2026-08-24", "open": 2.64, "close": 2.61, "high": 2.64, "low": 2.605, "volume": 82500.0, "turnover": 215799.99999999997, "turnover_estimated": false}, {"date": "2026-08-25", "open": 2.595, "close": 2.62, "high": 2.68, "low": 2.58, "volume": 97000.0, "turnover": 253700.0, "turnover_estimated": false}, {"date": "2026-08-26", "open": 2.6, "close": 2.6, "high": 2.61, "low": 2.6, "volume": 91000.0, "turnover": 236900.0, "turnover_estimated": false}, {"date": "2026-08-27", "open": 2.6, "close": 2.605, "high": 2.61, "low": 2.57, "volume": 225000.0, "turnover": 584100.0, "turnover_estimated": false}, {"date": "2026-08-28", "open": 2.6, "close": 2.59, "high": 2.6, "low": 2.58, "volume": 73500.0, "turnover": 190400.0, "turnover_estimated": false}, {"date": "2026-08-31", "open": 2.63, "close": 2.565, "high": 2.635, "low": 2.565, "volume": 119000.0, "turnover": 306700.0, "turnover_estimated": false}, {"date": "2026-09-01", "open": 2.565, "close": 2.445, "high": 2.595, "low": 2.4, "volume": 458500.0, "turnover": 1142800.0, "turnover_estimated": false}, {"date": "2026-09-02", "open": 2.445, "close": 2.42, "high": 2.445, "low": 2.38, "volume": 284500.0, "turnover": 680900.0, "turnover_estimated": false}, {"date": "2026-09-03", "open": 2.42, "close": 2.4, "high": 2.42, "low": 2.34, "volume": 242050.0, "turnover": 572500.0, "turnover_estimated": false}, {"date": "2026-09-04", "open": 2.4, "close": 2.395, "high": 2.44, "low": 2.355, "volume": 79050.0, "turnover": 188800.0, "turnover_estimated": false}, {"date": "2026-09-07", "open": 2.345, "close": 2.41, "high": 2.45, "low": 2.345, "volume": 126550.0, "turnover": 302300.0, "turnover_estimated": false}, {"date": "2026-09-08", "open": 2.41, "close": 2.4, "high": 2.41, "low": 2.36, "volume": 75500.0, "turnover": 179700.0, "turnover_estimated": false}, {"date": "2026-09-09", "open": 2.4, "close": 2.4, "high": 2.4, "low": 2.34, "volume": 52500.0, "turnover": 124500.0, "turnover_estimated": false}, {"date": "2026-09-10", "open": 2.34, "close": 2.285, "high": 2.345, "low": 2.28, "volume": 109000.0, "turnover": 252399.99999999997, "turnover_estimated": false}, {"date": "2026-09-11", "open": 2.34, "close": 2.395, "high": 2.4, "low": 2.335, "volume": 191500.0, "turnover": 455300.0, "turnover_estimated": false}, {"date": "2026-09-14", "open": 2.395, "close": 2.385, "high": 2.395, "low": 2.32, "volume": 90050.0, "turnover": 211400.0, "turnover_estimated": false}, {"date": "2026-09-15", "open": 2.33, "close": 2.3, "high": 2.33, "low": 2.3, "volume": 46500.0, "turnover": 107200.0, "turnover_estimated": false}, {"date": "2026-09-16", "open": 2.29, "close": 2.3, "high": 2.3, "low": 2.265, "volume": 46050.0, "turnover": 105000.0, "turnover_estimated": false}, {"date": "2026-09-17", "open": 2.275, "close": 2.27, "high": 2.28, "low": 2.21, "volume": 31525.0, "turnover": 70900.0, "turnover_estimated": false}, {"date": "2026-09-18", "open": 2.27, "close": 2.36, "high": 2.375, "low": 2.22, "volume": 95000.0, "turnover": 214400.0, "turnover_estimated": false}, {"date": "2026-09-21", "open": 2.35, "close": 2.38, "high": 2.38, "low": 2.285, "volume": 51000.0, "turnover": 120200.0, "turnover_estimated": false}, {"date": "2026-09-22", "open": 2.305, "close": 2.295, "high": 2.315, "low": 2.28, "volume": 65500.0, "turnover": 150900.0, "turnover_estimated": false}, {"date": "2026-09-23", "open": 2.28, "close": 2.37, "high": 2.38, "low": 2.23, "volume": 91500.0, "turnover": 208900.0, "turnover_estimated": false}, {"date": "2026-09-24", "open": 2.25, "close": 2.32, "high": 2.355, "low": 2.23, "volume": 39000.0, "turnover": 87400.0, "turnover_estimated": false}, {"date": "2026-09-25", "open": 2.23, "close": 2.2, "high": 2.265, "low": 2.2, "volume": 70550.0, "turnover": 156900.0, "turnover_estimated": false}]

pipeline/prospectus_pipeline/data/allot/packets/HKIPO-MB0664.md

## 公告全文

<<<PAGE 14>>>
14
BASIS OF ALLOCATION UNDER THE HONG KONG PUBLIC OFFERING
Subject to the satisfaction of the conditions set out in the Prospectus, a total of 26,280 valid 
applications made by the public will be conditionally allocated on the basis set out below:
NO. OF 
SHARES 
APPLIED 
FOR
NO. OF 
VALID 
APPLICATIONS
BASIS OF ALLOTMENT / BALLOT
APPROXIMATE 
PERCENTAGE 
ALLOTTED OF 
THE TOTAL 
NO. OF SHARES 
APPLIED FOR
POOL A
100
19,181
533 out of 19,181 to receive 100 Shares
2.78%
200
1,423
79 out of 1,423 to receive 100 Shares
2.78%
300
567
47 out of 567 to receive 100 Shares
2.76%
400
267
29 out of 267 to receive 100 Shares
2.72%
500
464
62 out of 464 to receive 100 Shares
2.67%
600
205
32 out of 205 to receive 100 Shares
2.60%
700
468
85 out of 468 to receive 100 Shares
2.59%
800
154
31 out of 154 to receive 100 Shares
2.52%
900
72
16 out of 72 to receive 100 Shares
2.47%
1,000
1,228
290 out of 1,228 to receive 100 Shares
2.36%
1,500
320
113 out of 320 to receive 100 Shares
2.35%
2,000
238
112 out of 238 to receive 100 Shares
2.35%
2,500
120
70 out of 120 to receive 100 Shares
2.33%
3,000
160
112 out of 160 to receive 100 Shares
2.33%
3,500
76
62 out of 76 to receive 100 Shares
2.33%
4,000
79
73 out of 79 to receive 100 Shares
2.31%
4,500
62
100 Shares plus 2 out of 62 to receive additional 
100 Shares
2.29%
5,000
163
100 Shares plus 23 out of 163 to receive additional 
100 Shares
2.28%
6,000
97
100 Shares plus 35 out of 97 to receive additional 
100 Shares
2.27%
7,000
76
100 Shares plus 44 out of 76 to receive additional 
100 Shares
2.26%
8,000
51
100 Shares plus 39 out of 51 to receive additional 
100 Shares
2.21%
9,000
35
100 Shares plus 34 out of 35 to receive additional 
100 Shares
2.19%
10,000
301
200 Shares plus 58 out of 301 to receive additional 
100 Shares
2.19%
20,000
132
400 Shares plus 51 out of 132 to receive additional 
100 Shares
2.19%